{
  "id": "nextjs",
  "label": "Next.js 15",
  "description": "App Router, TypeScript 5, Tailwind 4, Prisma 6, NextAuth v5",
  "files": {
    "agents": "AGENTS.md",
    "claude": ".claude/CLAUDE.md",
    "setup": "SETUP_GUIDE.md",
    "mcp": "mcp/mcp_config.json"
  },
  "rules_glob": ".cursor/rules/*.mdc",
  "mcp_packages": [
    "@modelcontextprotocol/server-postgres",
    "@modelcontextprotocol/server-github",
    "@modelcontextprotocol/server-filesystem",
    "@modelcontextprotocol/server-brave-search",
    "@notionhq/notion-mcp-server",
    "@modelcontextprotocol/server-memory",
    "@stripe/mcp",
    "@supabase/mcp-server-supabase"
  ]
}
