{
  "id": "nestjs",
  "label": "NestJS",
  "description": "NestJS 11, TypeScript strict, Prisma, Zod validation",
  "files": {
    "agents": "AGENTS.md",
    "claude": ".claude/CLAUDE.md",
    "setup": "SETUP_GUIDE.md",
    "mcp": "mcp/mcp_config.json"
  },
  "rules_glob": ".cursor/rules/*.mdc",
  "mcp_packages": [
    "@modelcontextprotocol/server-postgres",
    "@modelcontextprotocol/server-github",
    "@modelcontextprotocol/server-filesystem",
    "@modelcontextprotocol/server-memory"
  ]
}
