{
  "id": "vue_nuxt",
  "label": "Vue / Nuxt",
  "description": "Nuxt 3, TypeScript, Pinia, Vue Router, Nitro",
  "files": {
    "agents": "AGENTS.md",
    "claude": ".claude/CLAUDE.md",
    "setup": "SETUP_GUIDE.md",
    "mcp": "mcp/mcp_config.json"
  },
  "rules_glob": ".cursor/rules/*.mdc",
  "mcp_packages": [
    "@modelcontextprotocol/server-github",
    "@modelcontextprotocol/server-filesystem",
    "@modelcontextprotocol/server-memory"
  ]
}
